date,headline,url,source,scraped_on
2022-12-25,Tanzania Bankers Association (TBA) appoints NBC Bank’s MD as the new chairman,https://www.thecitizen.co.tz/tanzania/business/tanzania-bankers-association-tba-appoints-nbc-bank-s-md-as-the-new-chairman-4068650,The Citizen,2026-05-19
2022-12-21,NBC bond starts trading at DSE after successful sale,https://www.thecitizen.co.tz/tanzania/business/nbc-bond-starts-trading-at-dse-after-successful-sale--4062464,The Citizen,2026-05-19
2022-12-16,Why food price has gone up in Tanzania,https://www.thecitizen.co.tz/tanzania/business/why-food-price-has-gone-up-in-tanzania-4057036,The Citizen,2026-05-19
2022-12-16,"CRDB Bank, IFC agree to cooperate in six areas",https://www.thecitizen.co.tz/tanzania/business/crdb-bank-ifc-agree-to-cooperate-in-six-areas--4057282,The Citizen,2026-05-19
2022-12-15,NMB Bank in financial inclusion drive with new account,https://www.thecitizen.co.tz/tanzania/business/nmb-bank-in-financial-inclusion-drive-with-new-account-4056368,The Citizen,2026-05-19
2022-12-15,NBC’s Sh300billion goal in sight as bond oversubscribed by 30 percent,https://www.thecitizen.co.tz/tanzania/business/-nbc-s-sh300billion-goal-in-sight-as-bond-oversubscribed-by-30-percent-4056330,The Citizen,2026-05-19
2022-12-15,Firm linked to Kabanga nickel sets sights on global market,https://www.thecitizen.co.tz/tanzania/business/firm-linked-to-kabanga-nickel-sets-sights-on-global-market--4055598,The Citizen,2026-05-19
2022-12-14,Tanzania's ports performance increase as trade recovers,https://www.thecitizen.co.tz/tanzania/business/tanzania-s-ports-performance-increase-as-trade-recovers-4054460,The Citizen,2026-05-19
2022-12-13,"Tap heritage resources, AWHF urges Tanzania",https://www.thecitizen.co.tz/tanzania/business/tap-heritage-resources-awhf-urges-tanzania-4053746,The Citizen,2026-05-19
2022-12-13,Museveni: Why SMEs in East Africa don’t thrive,https://www.thecitizen.co.tz/tanzania/business/museveni-why-smes-in-east-africa-don-t-thrive-4053664,The Citizen,2026-05-19
2022-12-13,TRA to start taxing small traders in Kariakoo,https://www.thecitizen.co.tz/tanzania/business/tra-to-start-taxing-small-traders-in-kariakoo-4052762,The Citizen,2026-05-19
2022-12-12,BoT takes over control of Yetu Microfinance Bank,https://www.thecitizen.co.tz/tanzania/business/bot-takes-over-control-of-yetu-microfinance-bank-4052304,The Citizen,2026-05-19
2022-12-09,Tanzania among best investments destinations in Africa,https://www.thecitizen.co.tz/tanzania/business/tanzania-ranked-among-best-investments-destinations-in-africa-4047876,The Citizen,2026-05-19
2022-12-09,Billionaires on the back foot in 2022 - UBS,https://www.thecitizen.co.tz/tanzania/business/billionaires-on-the-back-foot-in-2022-ubs-4049494,The Citizen,2026-05-19
2022-12-02,13 lenders agree to establish alliance to support MSMEs,https://www.thecitizen.co.tz/tanzania/business/13-lenders-agree-to-establish-alliance-to-support-msmes-4040798,The Citizen,2026-05-19
2022-12-01,Standard Bank Group marks 160 years,https://www.thecitizen.co.tz/tanzania/business/a-brighter-future-beckons-as-africa-s-standard-bank-group-marks-160-years-4039658,The Citizen,2026-05-19
2022-11-29,Tanzania targets $2 billion in horticulture exports value by year 2030,https://www.thecitizen.co.tz/tanzania/business/tanzania-targets-2-billion-in-horticulture-exports-value-by-year-2030-4036914,The Citizen,2026-05-19
2022-11-29,TBS set to come up with new food import guidelines,https://www.thecitizen.co.tz/tanzania/business/tbs-set-to-come-up-with-new-food-import-guidelines-4036928,The Citizen,2026-05-19
2022-11-28,"Burundi banks on CRDB in women, youth programmes",https://www.thecitizen.co.tz/tanzania/business/burundi-banks-on-crdb-in-women-youth-programmes-4035764,The Citizen,2026-05-19
2022-11-28,Learning from Malaysia’s experience,https://www.thecitizen.co.tz/tanzania/business/learning-from-malaysia-s-experience-4035790,The Citizen,2026-05-19
2022-11-26,Farmers earn Sh169 billion as cashew auctions continue,https://www.thecitizen.co.tz/tanzania/business/farmers-earn-sh169-billion-as-cashew-auctions-continue--4033856,The Citizen,2026-05-19
2022-11-25,Potential of SMEs in empowering the women,https://www.thecitizen.co.tz/tanzania/business/potential-of-smes-in-empowering-the-women-4032858,The Citizen,2026-05-19
2022-11-24,"Tanzania, South Korea startups ink partnership deal",https://www.thecitizen.co.tz/tanzania/business/tanzania-south-korea-startups-ink-partnership-deal-4031778,The Citizen,2026-05-19
2022-11-24,How NMB managed to scoop 18 awards in 2022,https://www.thecitizen.co.tz/tanzania/business/how-nmb-managed-to-scoop-18-awards-in-2022-4031790,The Citizen,2026-05-19
2022-11-24,How Tanzania can avoid the pitfalls inherent in SMEs concepts,https://www.thecitizen.co.tz/tanzania/business/how-tanzania-can-avoid-the-pitfalls-inherent-in-smes-concepts-4031758,The Citizen,2026-05-19
2022-11-23,Why MSMEs may succeed in the agricultural sector,https://www.thecitizen.co.tz/tanzania/business/why-msmes-may-succeed-in-the-agricultural-sector-4030616,The Citizen,2026-05-19
2022-11-23,NBC to facilitate issuance of bond for water authority,https://www.thecitizen.co.tz/tanzania/business/nbc-to-facilitate-issuance-of-bond-for-water-authority-4030594,The Citizen,2026-05-19
2022-11-23,Clean cooking agenda now on global stage,https://www.thecitizen.co.tz/tanzania/business/clean-cooking-agenda-now-on-global-stage-4030604,The Citizen,2026-05-19
2022-11-22,Firm develops water purity tech,https://www.thecitizen.co.tz/tanzania/business/firm-develops-water-purity-tech-4030598,The Citizen,2026-05-19
2022-11-22,Standard Chartered Bank chips in to upskill women startups,https://www.thecitizen.co.tz/tanzania/business/standard-chartered-bank-chips-in-to-upskill-women-startups-in-cyber-security-4031350,The Citizen,2026-05-19
2022-11-22,Want to gauge SMEs sucess? Take a look at small industries,https://www.thecitizen.co.tz/tanzania/business/want-to-gauge-smes-sucess-take-a-look-at-small-industries-4029152,The Citizen,2026-05-19
2022-11-22,How Sukuk can pull more retail investors into Tanzania financial market,https://www.thecitizen.co.tz/tanzania/business/how-sukuk-can-pull-more-retail-investors-into-tanzania-financial-market-4028790,The Citizen,2026-05-19
2022-11-21,The game-changing role of SMEs in Tanzania’s economy,https://www.thecitizen.co.tz/tanzania/business/the-game-changing-role-of-smes-in-tanzania-s-economy-4027558,The Citizen,2026-05-19
2022-11-20,How hackers stole billions from Airtel Money in Uganda,https://www.thecitizen.co.tz/tanzania/business/how-hackers-stole-billions-from-airtel-money-in-uganda-4026838,The Citizen,2026-05-19
2022-11-19,New tea varieties to increase yields,https://www.thecitizen.co.tz/tanzania/business/new-tea-varieties-to-increase-yields-boost-farmers-earnings-4025694,The Citizen,2026-05-19
2022-11-16,TRA no longer using task forces to collect revenues,https://www.thecitizen.co.tz/tanzania/business/tra-no-longer-using-task-forces-to-collect-revenues-4022198,The Citizen,2026-05-19
2022-11-16,Why EAC needs to enhance investments in agriculture,https://www.thecitizen.co.tz/tanzania/business/why-eac-needs-to-enhance-investments-in-agriculture-4022204,The Citizen,2026-05-19
2022-11-12,Feedlot potential in Tanzania's cattle farming,https://www.thecitizen.co.tz/tanzania/business/unlocking-feedlot-potential-to-shape-tanzania-s-cattle-farming-4017858,The Citizen,2026-05-19
2022-11-10,Inflation rises to a five-year high,https://www.thecitizen.co.tz/tanzania/business/inflation-rises-to-a-five-year-high-4015684,The Citizen,2026-05-19
2022-11-10,KCB's Islamic bond kicks off trading,https://www.thecitizen.co.tz/tanzania/business/bot-calls-for-more-products-as-kcb-s-islamic-bond-trades--4015264,The Citizen,2026-05-19
2022-11-09,LG boss sees growth in East Africa market,https://www.thecitizen.co.tz/tanzania/business/lg-boss-sees-growth-in-east-africa-market-4014214,The Citizen,2026-05-19
2022-11-09,KCB targets Sh10 billion in maiden Sukuk bond,https://www.thecitizen.co.tz/tanzania/business/kcb-targets-sh10-billion-in-maiden-sukuk-bond-4014204,The Citizen,2026-05-19
2022-11-07,Kenya Airways cancels 'most flights' over pilots' strike,https://www.thecitizen.co.tz/tanzania/business/kenya-airways-cancels-most-flights-over-pilots-strike-4011362,The Citizen,2026-05-19
2022-11-06,Game store to shutdown on December 25,https://www.thecitizen.co.tz/tanzania/business/game-store-to-shutdown-on-december-25-3999998,The Citizen,2026-05-19
2022-11-05,Twitter sacks half of staff as Musk launches overhaul,https://www.thecitizen.co.tz/tanzania/business/twitter-sacks-half-of-staff-as-musk-launches-overhaul-4009588,The Citizen,2026-05-19
2022-11-05,KQ pilots’ strike clouds plans to increase flights,https://www.thecitizen.co.tz/tanzania/business/kq-pilots-strike-clouds-plans-to-increase-flights-4009502,The Citizen,2026-05-19
2022-11-05,Sugarcanebusinessa money spot for farmers,https://www.thecitizen.co.tz/tanzania/business/sugarcane-business-a-money-spot-for-farmers-4009546,The Citizen,2026-05-19
2022-11-04,Farmers gain from SBL’s cereal deal,https://www.thecitizen.co.tz/tanzania/business/-farmers-gain-from-sbl-s-cereal-deal-4008410,The Citizen,2026-05-19
2022-11-04,Kenya Airways pilots to strike from Saturday,https://www.thecitizen.co.tz/tanzania/business/kenya-airways-pilots-to-strike-from-saturday-4008316,The Citizen,2026-05-19
2022-11-02,NBC targets to raise Sh300 billion in new bond,https://www.thecitizen.co.tz/tanzania/business/nbc-targets-to-raise-sh300-billion-in-new-bond-4006144,The Citizen,2026-05-19
2022-11-01,South Africa's Pick n Pay embraces crypto payments,https://www.thecitizen.co.tz/tanzania/business/top-south-african-retailer-pick-n-pay-embraces-crypto-payments-4005280,The Citizen,2026-05-19
2022-10-30,How US billionaire’s row with son gave birth to Nairobi Hilton Hotel,https://www.thecitizen.co.tz/tanzania/business/how-us-billionaire-hotelier-s-row-with-son-gave-birth-to-nairobi-hilton-hotel-4002592,The Citizen,2026-05-19
2022-10-29,"KCB assets hit Sh1 trillion, graduates to tier-one status",https://www.thecitizen.co.tz/tanzania/business/-kcb-assets-hit-sh1-trillion-graduates-to-tier-one-status-3999392,The Citizen,2026-05-19
2022-10-29,Troubled Kenya Airways defaults on $841m loan,https://www.thecitizen.co.tz/tanzania/business/troubled-carrier-kq-defaults-on-841m-aircraft-acquisition-loan-4001676,The Citizen,2026-05-19
2022-10-27,Is your company adequately capitalised?,https://www.thecitizen.co.tz/tanzania/business/-is-your-company-adequately-capitalised--3999708,The Citizen,2026-05-19
2022-10-27,Do valuers contribute to growth of ‘bad loans’ in financial institutions?,https://www.thecitizen.co.tz/tanzania/business/-do-valuers-contribute-to-growth-of-bad-loans-in-financial-institutions--3999656,The Citizen,2026-05-19
2022-10-27,NMB’s gender parity gets global recognition,https://www.thecitizen.co.tz/tanzania/business/-nmb-s-gender-parity-gets-global-recognition-3999442,The Citizen,2026-05-19
2022-10-26,Finca launches new branch in Mbeya,https://www.thecitizen.co.tz/tanzania/business/finca-launches-new-branch-in-mbeya-4000424,The Citizen,2026-05-19
2022-10-25,Why maize is a new money-spinner,https://www.thecitizen.co.tz/tanzania/business/why-maize-is-a-new-money-spinner-3997340,The Citizen,2026-05-19
2022-10-24,What EU's type C charger rule means for Tanzania,https://www.thecitizen.co.tz/tanzania/business/what-eu-s-type-c-charger-rule-means-for-tanzania-3996412,The Citizen,2026-05-19
2022-10-23,Why EAC goods must meet global rules,https://www.thecitizen.co.tz/tanzania/business/why-eac-goods-must-meet-global-rules-3995024,The Citizen,2026-05-19
2022-10-20,Precision now increases flight frequencies to the Comoros,https://www.thecitizen.co.tz/tanzania/business/-precision-now-increases-flight-frequencies-to-the-comoros-3991746,The Citizen,2026-05-19
2022-10-19,Game Stores to shut down 14 outlets in East Africa,https://www.thecitizen.co.tz/tanzania/business/game-stores-yet-to-find-buyers-for-its-14-outlets-in-east-africa-3990660,The Citizen,2026-05-19
2022-10-19,Nape tells TCRA to stick to its role,https://www.thecitizen.co.tz/tanzania/business/-nape-tells-tcra-to-stick-to-its-role-3990576,The Citizen,2026-05-19
2022-10-18,Why your new phone does not have a charger and earphones,https://www.thecitizen.co.tz/tanzania/business/why-your-new-phone-does-not-have-a-charger-and-earphones--3988966,The Citizen,2026-05-19
2022-10-17,Firm distances itself from scam deals,https://www.thecitizen.co.tz/tanzania/business/-firm-distances-itself-from-scam-deals-3989380,The Citizen,2026-05-19
2022-10-17,BoA issues Sh72 billion in loans to SMEs,https://www.thecitizen.co.tz/tanzania/business/-boa-issues-sh72-billion-in-loans-to-smes-3988180,The Citizen,2026-05-19
2022-10-17,CRDB Bank scoops second international accolade this year,https://www.thecitizen.co.tz/tanzania/business/-crdb-bank-scoops-second-international-accolade-this-year-3988172,The Citizen,2026-05-19
2022-10-17,Why DSE turnover has fallen 65.5 percent,https://www.thecitizen.co.tz/tanzania/business/-why-dse-turnover-has-fallen-65-5-percent-3988160,The Citizen,2026-05-19
2022-10-16,Ethiopian Airlines shows off its first Boeing 767 freighter conversion,https://www.thecitizen.co.tz/tanzania/business/ethiopian-airlines-shows-off-its-first-boeing-767-freighter-conversion-3987152,The Citizen,2026-05-19
2022-10-14,NSSF puts Sh25.5 billion in regional bank,https://www.thecitizen.co.tz/tanzania/business/-nssf-puts-sh25-5-billion-in-regional-bank-3985172,The Citizen,2026-05-19
2022-10-14,Kenya denies defaulting on China railway debt,https://www.thecitizen.co.tz/tanzania/business/kenya-denies-defaulting-on-china-railway-debt-3984566,The Citizen,2026-05-19
2022-10-13,China slaps Kenya with KSh1.3bn fine for defaulting on SGR loan,https://www.thecitizen.co.tz/tanzania/business/china-slaps-kenya-with-ksh1-3bn-fine-for-defaulting-on-sgr-loan-3983402,The Citizen,2026-05-19
2022-10-12,Government reaffirms commitment to increase users of internet,https://www.thecitizen.co.tz/tanzania/business/government-reaffirms-commitment-to-increase-users-of-internet-3982714,The Citizen,2026-05-19
2022-10-11,TBL keen to lift up barley farmers,https://www.thecitizen.co.tz/tanzania/business/tbl-keen-to-lift-up-barley-farmers-3981164,The Citizen,2026-05-19
2022-10-11,Kenya Airways drops more aircraft,https://www.thecitizen.co.tz/tanzania/business/kenya-airways-drops-more-aircraft-in-cost-cutting-plan-3980852,The Citizen,2026-05-19
2022-10-10,Taha roots for share of East Africa’s $4.3 billion banana market,https://www.thecitizen.co.tz/tanzania/business/-taha-roots-for-share-of-east-africa-s-4-3-billion-banana-market-3979710,The Citizen,2026-05-19
2022-10-10,NMB Bank ups its single borrower limit to Sh250 billion,https://www.thecitizen.co.tz/tanzania/business/-nmb-bank-ups-its-single-borrower-limit-to-sh250-billion-3979712,The Citizen,2026-05-19
2022-10-07,"Sh4 billion set to boost sunflower, pulses agro-value chains",https://www.thecitizen.co.tz/tanzania/business/-sh4-billion-set-to-boost-sunflower-pulses-agro-value-chains-3976544,The Citizen,2026-05-19
2022-10-06,Washington-based research platform names three best PR firms,https://www.thecitizen.co.tz/tanzania/business/washington-based-research-platform-names-three-best-pr-firms-3976928,The Citizen,2026-05-19
2022-10-05,Top-rated Forex Brokers in Tanzania extracted via investfox.com,https://www.thecitizen.co.tz/tanzania/business/top-rated-forex-brokers-in-tanzania-extracted-via-investfox-com--3974514,The Citizen,2026-05-19
2022-10-05,How the diaspora can boost East African trade,https://www.thecitizen.co.tz/tanzania/business/-how-the-diaspora-can-boost-east-african-trade-3973876,The Citizen,2026-05-19
2022-10-04,How weak financial data costs East Africa billions in lost FDI,https://www.thecitizen.co.tz/tanzania/business/how-weak-financial-data-costs-east-africa-billions-in-lost-fdi-3972348,The Citizen,2026-05-19
2022-10-03,Block trading ups DSE performance,https://www.thecitizen.co.tz/tanzania/business/-block-trading-ups-dse-performance-3971220,The Citizen,2026-05-19
2022-09-30,CRDB learns from Malaysia SME success,https://www.thecitizen.co.tz/tanzania/business/-crdb-learns-from-malaysia-sme-success-3968360,The Citizen,2026-05-19
2022-09-29,Tanzania launches Africa’s first $300 million smart economic zone,https://www.thecitizen.co.tz/tanzania/business/tanzania-launches-africa-s-first-300-million-smart-economic-zone-3966604,The Citizen,2026-05-19
2022-09-28,Why American investors are showing interest in Tanzania,https://www.thecitizen.co.tz/tanzania/business/-why-american-investors-are-showing-interest-in-tanzania-3964948,The Citizen,2026-05-19
2022-09-27,Sh90 million whisky bottle hits the market,https://www.thecitizen.co.tz/tanzania/business/sh90-million-whisky-bottle-hits-the-market-3964040,The Citizen,2026-05-19
2022-09-27,Royal Tour film charms regional tourism expo,https://www.thecitizen.co.tz/tanzania/business/-royal-tour-film-charms-regional-tourism-expo-3963582,The Citizen,2026-05-19
2022-09-26,DSE equities fall Sh323 billion on headwinds,https://www.thecitizen.co.tz/tanzania/business/-dse-equities-fall-sh323-billion-on-headwinds-3962072,The Citizen,2026-05-19
2022-09-26,NMB Bank retains retail award for value-added financial services,https://www.thecitizen.co.tz/tanzania/business/-nmb-bank-retains-retail-award-for-value-added-financial-services-3962102,The Citizen,2026-05-19
2022-09-23,Toyota shuts Russian factory due to supply chain problems,https://www.thecitizen.co.tz/tanzania/business/toyota-shuts-russian-factory-due-to-supply-chain-problems-3959834,The Citizen,2026-05-19
2022-09-23,Tanzania plans to buy cargo aircraft,https://www.thecitizen.co.tz/tanzania/business/tanzania-plans-to-buy-cargo-aircraft-3959534,The Citizen,2026-05-19
2022-09-22,"Tanzania, India for stronger tech ties ahead of exhibition",https://www.thecitizen.co.tz/tanzania/business/-tanzania-india-for-stronger-tech-ties-ahead-of-exhibition-3957502,The Citizen,2026-05-19
2022-09-22,Azania Bank in new digital payment move,https://www.thecitizen.co.tz/tanzania/business/-azania-bank-in-new-digital-payment-move-3957490,The Citizen,2026-05-19
2022-09-22,NBC Bank signs pact with equipment firm to finance farmers,https://www.thecitizen.co.tz/tanzania/business/-nbc-bank-signs-pact-with-equipment-firm-to-finance-farmers-3957482,The Citizen,2026-05-19
2022-09-21,"Tanzania’s avocados fetch Sh10,000 apiece in Belgium",https://www.thecitizen.co.tz/tanzania/business/tanzania-s-avocados-fetch-sh10-000-apiece-in-belgium-3956682,The Citizen,2026-05-19
2022-09-20,NBC Bank aids school in Mbeya with water tanks,https://www.thecitizen.co.tz/tanzania/business/-nbc-bank-aids-school-in-mbeya-with-water-tanks-3955124,The Citizen,2026-05-19
2022-09-20,BancABC launches a deposit campaign with up-front cash,https://www.thecitizen.co.tz/tanzania/business/-bancabc-launches-a-deposit-campaign-with-up-front-cash-3954936,The Citizen,2026-05-19
2022-09-20,Why EAC exchange rates are high,https://www.thecitizen.co.tz/tanzania/business/-why-eac-exchange-rates-are-high-3954920,The Citizen,2026-05-19
2022-09-20,How new expressway will further hurt Kenya’s SGR fortunes,https://www.thecitizen.co.tz/tanzania/business/how-new-expressway-will-further-hurt-kenya-s-sgr-fortunes-3954868,The Citizen,2026-05-19
2022-09-20,"Kenyan firms hit as Microsoft, Google talent war raises pay",https://www.thecitizen.co.tz/tanzania/business/kenyan-firms-hit-as-microsoft-google-talent-war-raises-pay-3954814,The Citizen,2026-05-19
2022-09-19,Pula Group’s investment pledge after Tanzania entry,https://www.thecitizen.co.tz/tanzania/business/pula-group-s-investment-pledge-after-tanzania-entry-3954162,The Citizen,2026-05-19
2022-09-18,Mtwara port cargo volume up thanks to high exports of coal,https://www.thecitizen.co.tz/tanzania/business/mtwara-port-cargo-volume-up-thanks-to-high-exports-of-coal-3952992,The Citizen,2026-05-19
2022-09-18,Kenya’s new move on SGR to upset China and Uganda,https://www.thecitizen.co.tz/tanzania/business/kenya-new-move-on-sgr-to-upset-china-and-uganda-3952752,The Citizen,2026-05-19
2022-09-16,"CRDB secures $130 million for credit to private sector, SMEs",https://www.thecitizen.co.tz/tanzania/business/crdb-secures-130-million-for-credit-to-private-sector-smes-3951274,The Citizen,2026-05-19
2022-09-16,Six firms blacklisted from operating warehouses for cashew nuts,https://www.thecitizen.co.tz/tanzania/business/-six-firms-blacklisted-from-operating-warehouses-for-cashew-nuts-3946752,The Citizen,2026-05-19
2022-09-15,Optimism as government meets with mobile operators over levies,https://www.thecitizen.co.tz/tanzania/business/-optimism-as-government-meets-with-mobile-operators-over-levies-3949372,The Citizen,2026-05-19
2022-09-14,Hard times for Kenya's SGR as port operations return to Mombasa,https://www.thecitizen.co.tz/tanzania/business/hard-times-for-kenya-s-sgr-as-port-operations-return-to-mombasa-3948302,The Citizen,2026-05-19
2022-09-12,"Uber, Bolt o resume services in Tanzania",https://www.thecitizen.co.tz/tanzania/business/uber-bolt-set-to-resume-services-in-tanzania-3945910,The Citizen,2026-05-19
2022-09-09,NMB Bank details women empowerment initiatives,https://www.thecitizen.co.tz/tanzania/business/-nmb-bank-details-women-empowerment-initiatives-3942756,The Citizen,2026-05-19
2022-09-08,"Meet Susan, fierce businesswoman making strides in competitive space",https://www.thecitizen.co.tz/tanzania/business/-meet-susan-fierce-businesswoman-making-strides-in-competitive-space-3941628,The Citizen,2026-05-19
2022-09-08,Hope for $40billion LNG deal as govt meets Shell officials,https://www.thecitizen.co.tz/tanzania/business/-hope-for-40billion-lng-deal-as-govt-meets-shell-officials-3941138,The Citizen,2026-05-19
2022-09-07,Cards no longer needed to withdraw money from Absa,https://www.thecitizen.co.tz/tanzania/business/cards-no-longer-needed-to-withdraw-money-from-absa-3940088,The Citizen,2026-05-19
2022-09-07,CRDB introduces solution for late-hour deposit need,https://www.thecitizen.co.tz/tanzania/business/-crdb-introduces-solution-for-late-hour-deposit-need-3939938,The Citizen,2026-05-19
2022-09-07,Vodacom records Sh103 billion loss in revenue due to levies,https://www.thecitizen.co.tz/tanzania/business/vodacom-records-sh103-billion-loss-in-revenue-due-to-levies-3939716,The Citizen,2026-05-19
2022-09-06,Malaysia stages biggest book sale in Dar es Salaam,https://www.thecitizen.co.tz/tanzania/business/malaysia-stages-biggest-book-sale-in-dar-es-salaam-3939088,The Citizen,2026-05-19
2022-09-04,Issues affecting real estate sector in Tanzania,https://www.thecitizen.co.tz/tanzania/business/issues-affecting-real-estate-sector-in-tanzania-3936568,The Citizen,2026-05-19
2022-09-03,How Tanzania can meet edible oil challenges,https://www.thecitizen.co.tz/tanzania/business/this-is-how-tanzania-can-meet-edible-oil-challenges--3935834,The Citizen,2026-05-19
2022-09-01,"Air Tanzania eyes Dar-London, more long-haul routes",https://www.thecitizen.co.tz/tanzania/business/air-tanzania-eyes-dar-london-more-long-haul-routes-3933734,The Citizen,2026-05-19
2022-09-01,Let’s reimagine the future of Tourism in Tanzania,https://www.thecitizen.co.tz/tanzania/business/let-s-reimagine-the-future-of-tourism-in-tanzania-3933894,The Citizen,2026-05-19
2022-08-31,NCBA invests Sh40 billion in its Tanzania subsidiary,https://www.thecitizen.co.tz/tanzania/business/ncba-invests-millions-in-its-tanzania-subsidiary-3932344,The Citizen,2026-05-19
2022-08-29,EXCLUSIVE: CEOs happy with government’s pro-businesspolicies,https://www.thecitizen.co.tz/tanzania/business/exclusive-ceos-happy-with-government-s-pro-business-policies-3930154,The Citizen,2026-05-19
2022-08-29,"Stanbic Bank, NEEC sign deal to boost SMEs growth",https://www.thecitizen.co.tz/tanzania/business/-stanbic-bank-neec-sign-deal-to-boost-smes-growth-3929610,The Citizen,2026-05-19
2022-08-27,Making finance work for the agriculture sector,https://www.thecitizen.co.tz/tanzania/business/making-finance-work-for-the-agriculture-sector-3928142,The Citizen,2026-05-19
2022-08-26,TotalEnergies to sell stake in war-linked Russian gas field,https://www.thecitizen.co.tz/tanzania/business/totalenergies-to-sell-stake-in-war-linked-russian-gas-field-3927598,The Citizen,2026-05-19
2022-08-26,"Government, NMB Bank in Sh100 million ‘Diaspora digital hub' deal",https://www.thecitizen.co.tz/tanzania/business/government-nmb-bank-in-sh100-million-diaspora-digital-hub-deal-3927214,The Citizen,2026-05-19
2022-08-25,Tanzania and the $1 million Vietnam conundrum…,https://www.thecitizen.co.tz/tanzania/business/tanzania-and-the-1-million-vietnam-conundrum--3926450,The Citizen,2026-05-19
2022-08-25,China locks out Kenya from new debt relief deal,https://www.thecitizen.co.tz/tanzania/business/why-china-locked-kenya-out-of-new-debt-relief-deal-3926456,The Citizen,2026-05-19
2022-08-24,"UK protests Kenya ban on second-hand buses, trucks",https://www.thecitizen.co.tz/tanzania/business/uk-protests-kenya-ban-on-second-hand-buses-trucks-3925056,The Citizen,2026-05-19
2022-08-24,Passenger dies aboard Kenya Airways flight,https://www.thecitizen.co.tz/tanzania/business/passenger-dies-aboard-kenya-airways-flight-from-new-york--3924478,The Citizen,2026-05-19
2022-08-24,I&M to accelerate the digital shift after posting 16 percent profit,https://www.thecitizen.co.tz/tanzania/business/i-m-to-accelerate-the-digital-shift-after-posting-16-percent-profit-3924618,The Citizen,2026-05-19
2022-08-23,Lamborghini has already sold all its cars until 2024,https://www.thecitizen.co.tz/tanzania/business/lamborghini-has-already-sold-all-its-cars-until-2024-3924256,The Citizen,2026-05-19
2022-08-23,EAC services exports hit $12.9 billion,https://www.thecitizen.co.tz/tanzania/business/eac-services-exports-hit-12-9-billion-3923638,The Citizen,2026-05-19
