date,headline,url,source,scraped_on
2022-08-23,Nairobi Stock Exchange fall after Raila Odinga’s Supreme Court test of poll results,https://www.thecitizen.co.tz/tanzania/business/nairobi-stock-exchange-fall-after-raila-odinga-s-supreme-court-test-of-poll-results-3923578,The Citizen,2026-05-19
2022-08-22,Mwanga Hakika Microfinance graduates to commercial bank,https://www.thecitizen.co.tz/tanzania/business/mwanga-hakika-microfinance-graduates-to-commercial-bank-3922430,The Citizen,2026-05-19
2022-08-18,Post-Covid restart offers African airlines a new chance,https://www.thecitizen.co.tz/tanzania/business/post-covid-restart-offers-african-airlines-a-new-chance-3918920,The Citizen,2026-05-19
2022-08-18,It's a high speed race as telcos show interest in deploying 5G,https://www.thecitizen.co.tz/tanzania/business/it-s-a-high-speed-race-as-telcos-show-interest-in-deploying-5g-3913316,The Citizen,2026-05-19
2022-08-15,Investors snap up NMB stocks after record half-year results,https://www.thecitizen.co.tz/tanzania/business/investors-snap-up-nmb-stocks-after-record-half-year-results-3915638,The Citizen,2026-05-19
2022-08-13,What cassava industrial call means to Tanzanian farmers,https://www.thecitizen.co.tz/tanzania/business/what-cassava-industrial-call-means-to-tanzanian-farmers-3913312,The Citizen,2026-05-19
2022-08-12,Saudis in Tanzania to explore investment opportunities,https://www.thecitizen.co.tz/tanzania/business/saudis-in-tanzania-to-explore-investment-opportunities--3912482,The Citizen,2026-05-19
2022-08-11,Smallholder farmers are the backbone of TDLbusiness,https://www.thecitizen.co.tz/tanzania/business/tanzania-breweries-limited-tbl-direct-contracting-yields-resilient-farming-systems-better-livelihoods--3910740,The Citizen,2026-05-19
2022-08-09,Bank of Tanzania tasked to review loan policies,https://www.thecitizen.co.tz/tanzania/business/bank-of-tanzania-tasked-to-review-loan-policies-3908692,The Citizen,2026-05-19
2022-08-09,Exim to support cross-border trade,https://www.thecitizen.co.tz/tanzania/business/exim-to-support-cross-border-trade-3908690,The Citizen,2026-05-19
2022-08-08,Tanzanian businessman faces Interpol arrest,https://www.thecitizen.co.tz/tanzania/business/tanzanian-businessman-faces-interpol-arrest-3907166,The Citizen,2026-05-19
2022-08-04,Tourism share of GDP set to hit 20 percent in 2025,https://www.thecitizen.co.tz/tanzania/business/tourism-share-of-gdp-set-to-hit-20-percent-in-2025-3902860,The Citizen,2026-05-19
2022-08-02,Latest review between Tanzania and Egypt to create flexibility in airlinebusiness,https://www.thecitizen.co.tz/tanzania/business/latest-review-between-tanzania-and-egypt-to-create-flexibility-in-airline-business-3899390,The Citizen,2026-05-19
2022-07-29,Government mulls one stop shop for tourism tax issues,https://www.thecitizen.co.tz/tanzania/business/government-mulls-one-stop-shop-for-tourism-tax-issues-3896378,The Citizen,2026-05-19
2022-07-29,50 Egyptian companies interested in investing in Tanzania,https://www.thecitizen.co.tz/tanzania/business/50-egyptian-companies-interested-in-investing-in-tanzania-3896334,The Citizen,2026-05-19
2022-07-28,"Gaming revenue increasing, board discloses",https://www.thecitizen.co.tz/tanzania/business/gaming-revenue-increasing-board-discloses-3896346,The Citizen,2026-05-19
2022-07-26,CRDB Bank targets bigger pie of the blue economy proceeds in the Spice Islands,https://www.thecitizen.co.tz/tanzania/business/crdb-bank-targets-bigger-pie-of-the-blue-economy-proceeds-in-the-spice-islands-3892534,The Citizen,2026-05-19
2022-07-23,Prioritisation of investment in Tanzania’s ports key to growth,https://www.thecitizen.co.tz/tanzania/business/prioritisation-of-investment-in-tanzania-s-ports-key-to-growth-3889652,The Citizen,2026-05-19
2022-07-21,Two insurance firms join hands for a new comprehensive service,https://www.thecitizen.co.tz/tanzania/business/two-insurance-firms-join-hands-for-a-new-comprehensive-service-3888350,The Citizen,2026-05-19
2022-07-21,Kenya freezes Rostam Aziz's Taifa cooking gas plant,https://www.thecitizen.co.tz/tanzania/business/kenya-freezes-tanzanian-tycoon-s-cooking-gas-plant--3887118,The Citizen,2026-05-19
2022-07-20,Businessconsultations by Letshego Bank reaps benefits,https://www.thecitizen.co.tz/tanzania/business/business-consultations-by-letshego-bank-reaps-benefits-3895006,The Citizen,2026-05-19
2022-07-20,CRDB voted Best Bank in Tanzania by EuroMoney,https://www.thecitizen.co.tz/tanzania/business/crdb-voted-best-bank-in-tanzania-by-euromoney-3887266,The Citizen,2026-05-19
2022-07-18,Exim Bank completes acquisition of FNB Tanzania,https://www.thecitizen.co.tz/tanzania/business/exim-bank-completes-acquisition-of-fnb-tanzania-3883616,The Citizen,2026-05-19
2022-07-18,Kenya Airways suspends London route ticket sales on airport crisis,https://www.thecitizen.co.tz/tanzania/business/kenya-airways-suspends-london-route-ticket-sales-on-airport-crisis-3883536,The Citizen,2026-05-19
2022-07-16,Two global ground handling firms reach acquisition agreement,https://www.thecitizen.co.tz/tanzania/business/two-global-ground-handling-firms-reach-acquisition-agreement-3881754,The Citizen,2026-05-19
2022-07-12,Leaked: How Uber used US politicians to break into new markets,https://www.thecitizen.co.tz/tanzania/business/how-uber-used-us-politicians-to-break-into-new-markets--3876840,The Citizen,2026-05-19
2022-07-11,Chinese products attract visitors to Tanzania's largest trade fair,https://www.thecitizen.co.tz/tanzania/business/chinese-products-attract-visitors-to-tanzania-s-largest-trade-fair-3875916,The Citizen,2026-05-19
2022-07-08,Kenyan banks struggling to grow in Tanzania,https://www.thecitizen.co.tz/tanzania/business/kenyan-banks-struggling-to-grow-in-tanzania-3872934,The Citizen,2026-05-19
2022-07-05,Bolt opens Africa hub in Nairobi,https://www.thecitizen.co.tz/tanzania/business/bolt-opens-africa-hub-in-nairobi-3869888,The Citizen,2026-05-19
2022-06-30,Government receives Sh36 billion in dividend from CRDB,https://www.thecitizen.co.tz/tanzania/business/government-receives-sh36-billion-in-dividend-from-crdb-3864694,The Citizen,2026-05-19
2022-06-28,Uganda U-turn on car imports upsets Kenya vehicle dealers,https://www.thecitizen.co.tz/tanzania/business/uganda-u-turn-on-car-imports-upsets-kenya-vehicle-dealers-3862704,The Citizen,2026-05-19
2022-06-27,Tanzania and Kenya still locked in trade dispute,https://www.thecitizen.co.tz/tanzania/business/tanzania-and-kenya-still-locked-in-trade-dispute-3861148,The Citizen,2026-05-19
2022-06-26,Tanzania's Taifa Gas licensed to set up plant in Kenya,https://www.thecitizen.co.tz/tanzania/business/tanzania-s-taifa-gas-licensed-to-set-up-plant-in-kenya-3860240,The Citizen,2026-05-19
2022-06-22,NMB payment system earns government Sh8.6 trillion,https://www.thecitizen.co.tz/tanzania/business/nmb-payment-system-earns-government-sh8-6-trillion-3856308,The Citizen,2026-05-19
2022-06-22,Turkish Airlines resumes direct flights to Kilimanjaro,https://www.thecitizen.co.tz/tanzania/business/turkish-airlines-resumes-direct-flights-to-kilimanjaro-3856476,The Citizen,2026-05-19
2022-06-22,4 million Kenyans suffer crypto crash losses,https://www.thecitizen.co.tz/tanzania/business/4-million-kenyans-suffer-crypto-crash-losses-3856010,The Citizen,2026-05-19
2022-06-21,Ground handlers change tack as regulator rejects price cap,https://www.thecitizen.co.tz/tanzania/business/ground-handlers-change-tack-as-regulator-rejects-price-cap-3854814,The Citizen,2026-05-19
2022-06-20,Tanzania Commercial Bank to pay dividend after Sh19.7bn profit,https://www.thecitizen.co.tz/tanzania/business/tanzania-commercial-bank-to-pay-dividend-after-sh19-7bn-profit-3854126,The Citizen,2026-05-19
2022-06-18,"Mushroom farming: The opportunities, challenges",https://www.thecitizen.co.tz/tanzania/business/-mushroom-farming-the-opportunities-challenges-3852514,The Citizen,2026-05-19
2022-06-18,Transforming Tanzania’s agriculture sector by developing value chains,https://www.thecitizen.co.tz/tanzania/business/-transforming-tanzania-s-agriculture-sector-by-developing-value-chains-3852506,The Citizen,2026-05-19
2022-06-16,Vodacom customers to share Sh3.3 billion in profits,https://www.thecitizen.co.tz/tanzania/business/vodacom-customers-to-share-sh3-3-billion-in-profits-3850394,The Citizen,2026-05-19
2022-06-15,"Tanzania, Oman oil and gas bodies ink deal",https://www.thecitizen.co.tz/tanzania/business/tanzania-oman-oil-and-gas-bodies-ink-deal-3849492,The Citizen,2026-05-19
2022-06-14,Oman Airports to develop Kilimanjaro International Airport,https://www.thecitizen.co.tz/tanzania/business/oman-airports-to-develop-kilimanjaro-international-airport-3848016,The Citizen,2026-05-19
2022-06-14,TPA raises Rwanda market share on enhanced strategy,https://www.thecitizen.co.tz/tanzania/business/tpa-raises-rwanda-market-share-on-enhanced-strategy-3848012,The Citizen,2026-05-19
2022-06-14,Akzo Nobel N.V.acquires Kansai Paint's Africabusiness,https://www.thecitizen.co.tz/tanzania/business/akzo-nobel-n-v-acquires-kansai-paint-s-africa-business-3847982,The Citizen,2026-05-19
2022-06-13,DCB Bank takes pride in provision of Sh1tr loans,https://www.thecitizen.co.tz/tanzania/business/dcb-bank-takes-pride-in-provision-of-sh1tr-loans-3847064,The Citizen,2026-05-19
2022-06-10,Kenya slaps new levies on Ugandan eggs,https://www.thecitizen.co.tz/tanzania/business/kenya-slaps-new-levies-on-ugandan-eggs--3844240,The Citizen,2026-05-19
2022-06-10,Kenyan banks lead regional peers with 150 new branches,https://www.thecitizen.co.tz/tanzania/business/kenyan-banks-lead-regional-peers-with-150-new-branches--3844176,The Citizen,2026-05-19
2022-06-09,NMB and CRDB Bank dominate bancassurance trade,https://www.thecitizen.co.tz/tanzania/business/nmb-and-crdb-bank-dominate-bancassurance-trade-3843598,The Citizen,2026-05-19
2022-06-09,"Housing industry: Chances, challenges and its future",https://www.thecitizen.co.tz/tanzania/business/housing-industry-chances-challenges-and-its-future-3843458,The Citizen,2026-05-19
2022-06-09,Manufacturers want budget that will speed up recovery,https://www.thecitizen.co.tz/tanzania/business/manufacturers-want-budget-that-will-speed-up-recovery-3843230,The Citizen,2026-05-19
2022-06-06,European Union revokes Kenya Airways plane servicing licence,https://www.thecitizen.co.tz/tanzania/business/european-union-revokes-kenya-airways-plane-servicing-licence-3840196,The Citizen,2026-05-19
2022-06-06,EA miles away from tapping the potential of trade finance,https://www.thecitizen.co.tz/tanzania/business/-ea-miles-away-from-tapping-the-potential-of-trade-finance-3840092,The Citizen,2026-05-19
2022-06-02,Kenya’s plan to seize LPG logisticsbusinessfrom Tanzania,https://www.thecitizen.co.tz/tanzania/business/kenya-s-plan-to-seize-lpg-logistics-business-from-tanzania-3836212,The Citizen,2026-05-19
2022-06-02,Tanzania and Kenya accuse Uganda of stalling $60 billion lake project,https://www.thecitizen.co.tz/tanzania/business/tanzania-and-kenya-accuse-uganda-of-stalling-60-billion-lake-project-3836178,The Citizen,2026-05-19
2022-06-02,Maweni Limestone sold to Chinese firm for 238 billion,https://www.thecitizen.co.tz/tanzania/business/arm-tanzania-assets-sale-raises-sh40-billion-surplus-3835456,The Citizen,2026-05-19
2022-06-01,Johari Rotana reopens its doors in Dar after two years,https://www.thecitizen.co.tz/tanzania/business/johari-rotana-reopens-its-doors-in-dar-after-two-years-3834886,The Citizen,2026-05-19
2022-06-01,Jubilee gets Sh20.8 billion from Tanzania unit stake sale to Allianz,https://www.thecitizen.co.tz/tanzania/business/-jubilee-gets-sh20-8-billion-from-tanzania-unit-stake-sale-to-allianz-3834516,The Citizen,2026-05-19
2022-06-01,"TBL, Vodacom now use blockchain to empower farmers",https://www.thecitizen.co.tz/tanzania/business/tbl-vodacom-now-use-blockchain-to-empower-farmers-3834324,The Citizen,2026-05-19
2022-05-31,Tanzania starts exporting coal to European markets,https://www.thecitizen.co.tz/tanzania/business/tanzania-starts-exporting-coal-to-european-markets-3833154,The Citizen,2026-05-19
2022-05-31,Dollar shortage in Kenya sparks two parallel exchange rates,https://www.thecitizen.co.tz/tanzania/business/dollar-shortage-in-kenya-sparks-two-parallel-exchange-rates-3833084,The Citizen,2026-05-19
2022-05-30,CRDB offers 9 percent deposit interest rate in new campaign,https://www.thecitizen.co.tz/tanzania/business/crdb-offers-9-percent-deposit-interest-rate-in-new-campaign-3832170,The Citizen,2026-05-19
2022-05-29,Tanzania opens new consulate in China's richest province,https://www.thecitizen.co.tz/tanzania/business/tanzania-opens-new-consulate-in-china-s-richest-province-3831072,The Citizen,2026-05-19
2022-05-28,"Brela threatens to revoke registration of 5,000 dormant firms",https://www.thecitizen.co.tz/tanzania/business/brela-threatens-to-revoke-registration-of-5-000-dormant-firms-3830320,The Citizen,2026-05-19
2022-05-28,"NMG, TBL in new deal to mitigate climate change",https://www.thecitizen.co.tz/tanzania/business/nmg-tbl-in-new-deal-to-mitigate-climate-change-3830312,The Citizen,2026-05-19
2022-05-26,"Alibaba profit slumps nearly 60% as tech crackdown, Covid bite",https://www.thecitizen.co.tz/tanzania/business/alibaba-profit-slumps-nearly-60-as-tech-crackdown-covid-bite-3828336,The Citizen,2026-05-19
2022-05-25,Fast-rising Fintech Bankingly closes successful investment round for $11 Million,https://www.thecitizen.co.tz/tanzania/business/fast-rising-fintech-bankingly-closes-successful-investment-round-for-11-million--3826008,The Citizen,2026-05-19
2022-05-24,Nsekela: Why CRDB will do well in DRC,https://www.thecitizen.co.tz/tanzania/business/nsekela-why-crdb-will-do-well-in-drc-3825362,The Citizen,2026-05-19
2022-05-23,Dar port reaps from rising political heat in Kenya,https://www.thecitizen.co.tz/tanzania/business/dar-port-reaps-from-rising-political-heat-ahead-kenya-elections-3824842,The Citizen,2026-05-19
2022-05-22,"DRC enters shippingbusiness, set to rock EA boats",https://www.thecitizen.co.tz/tanzania/business/drc-enters-shipping-business-set-to-rock-ea-boats-3823588,The Citizen,2026-05-19
2022-05-22,Kenya's debt repayments to China shoot to Sh1.4 trillion,https://www.thecitizen.co.tz/tanzania/business/kenya-s-debt-repayments-to-china-shoot-to-sh1-4-trillion-3823506,The Citizen,2026-05-19
2022-05-19,Allianz completes acquisition of Jubilee Insurance Tanzania,https://www.thecitizen.co.tz/tanzania/business/allianz-completes-acquisition-of-jubilee-insurance-tanzania-3820464,The Citizen,2026-05-19
2022-05-18,Wines of South Africa comes to Tanzania,https://www.thecitizen.co.tz/tanzania/business/wines-of-south-africa-comes-to-tanzania-3819688,The Citizen,2026-05-19
2022-05-17,CRDB shareholders await record Sh58 billion in dividends,https://www.thecitizen.co.tz/tanzania/business/crdb-shareholders-await-record-sh58-billion-in-dividends-3818190,The Citizen,2026-05-19
2022-05-16,NMB Bank allocates Sh100bn for loans to stakeholders in tourism,https://www.thecitizen.co.tz/tanzania/business/nmb-bank-allocates-sh100bn-for-loans-to-stakeholders-in-tourism-3817264,The Citizen,2026-05-19
2022-05-11,Tanzania's Smart Codes hires African corporate leader,https://www.thecitizen.co.tz/tanzania/business/tanzania-s-smart-codes-hires-african-corporate-leader-3811786,The Citizen,2026-05-19
2022-05-11,Infinix Launches Fresh & Stylish All-New HOT 12 in Tanzania,https://www.thecitizen.co.tz/tanzania/business/infinix-launches-fresh-stylish-all-new-hot-12-in-tanzania-3811668,The Citizen,2026-05-19
2022-05-10,Tanzania makes U-turn on Uganda sugar,https://www.thecitizen.co.tz/tanzania/business/samia-visit-tanzania-makes-u-turn-on-uganda-sugar-3811524,The Citizen,2026-05-19
2022-05-10,Sitholizwe Mdlalose to step down as Vodacom Tanzania MD,https://www.thecitizen.co.tz/tanzania/business/sitholizwe-mdlalose-to-step-down-as-vodacom-tanzania-md-3810762,The Citizen,2026-05-19
2022-05-10,Uber pushes for arbitration in fares row with drivers in Kenya,https://www.thecitizen.co.tz/tanzania/business/uber-pushes-for-arbitration-in-fares-row-with-drivers-in-kenya-3810426,The Citizen,2026-05-19
2022-05-08,Change in dominance as Tanzania airlines battle for the skies,https://www.thecitizen.co.tz/tanzania/business/change-in-dominance-as-tanzania-airlines-battle-for-the-skies-3808424,The Citizen,2026-05-19
2022-05-06,"Sanlam, Allianz join forces to form African insurance giant",https://www.thecitizen.co.tz/tanzania/business/sanlam-allianz-join-forces-to-form-african-insurance-giant-3806896,The Citizen,2026-05-19
2022-05-04,EAC exports to the European Union hit $2.8 billion,https://www.thecitizen.co.tz/tanzania/business/eac-eu-seek-enhanced-trade-ties-as-exports-hit-2-8-billion-3804108,The Citizen,2026-05-19
2022-04-28,Hilton Hotel shuts Kenya operations after 53 years,https://www.thecitizen.co.tz/tanzania/business/hilton-hotel-shuts-kenya-operations-after-53-years--3797164,The Citizen,2026-05-19
2022-04-27,African airlines sustain high passenger growth as more states end covid curbs,https://www.thecitizen.co.tz/tanzania/business/african-airlines-sustain-high-passenger-growth-as-more-states-end-covid-curbs-3796358,The Citizen,2026-05-19
2022-04-25,Rwanda tea continues to outprice Tanzania's at Mombasa auction,https://www.thecitizen.co.tz/tanzania/business/rwanda-tea-continues-to-outprice-tanzania-s-at-mombasa-auction-3794030,The Citizen,2026-05-19
2022-04-22,How planned Coop Bank will boost agriculture,https://www.thecitizen.co.tz/tanzania/business/how-planned-coop-bank-will-boost-agriculture-3790680,The Citizen,2026-05-19
2022-04-21,Entebbe airport resumes operation after 20-hour suspension of flights,https://www.thecitizen.co.tz/tanzania/business/entebbe-airport-resumes-operation-after-20-hour-suspension-of-flights-3789784,The Citizen,2026-05-19
2022-04-21,Netflix loses subscribers for first time in more than a decade,https://www.thecitizen.co.tz/tanzania/business/netflix-loses-subscribers-for-first-time-in-more-than-a-decade-3789758,The Citizen,2026-05-19
2022-04-20,Nation Media Group posts tenfold increase in full-year net profit,https://www.thecitizen.co.tz/tanzania/business/nation-media-group-posts-tenfold-increase-in-full-year-net-profit-3788644,The Citizen,2026-05-19
2022-04-19,Royal Tour is good for businesses says CRDB CEO,https://www.thecitizen.co.tz/tanzania/business/royal-tour-is-good-for-businesses-says-crdb-ceo-3788716,The Citizen,2026-05-19
2022-04-18,"Jambojet, Taifa Gas reap big in new Dar-Nairobi trade agreement",https://www.thecitizen.co.tz/tanzania/business/jambojet-taifa-gas-reap-big-in-new-dar-nairobi-trade-agreement-3786046,The Citizen,2026-05-19
2022-04-18,Foreign currency deposits in Kenyan banks hit all-time high,https://www.thecitizen.co.tz/tanzania/business/foreign-currency-deposits-in-kenyan-banks-hit-all-time-high--3786034,The Citizen,2026-05-19
2022-04-15,"StanChart to exit consumer, private andbusinessbanking in Tanzania",https://www.thecitizen.co.tz/tanzania/business/stanchart-to-exit-consumer-private-and-business-banking-in-tanzania-3782356,The Citizen,2026-05-19
2022-04-14,Elon Musk bids $43 billion in hostile takeover of Twitter,https://www.thecitizen.co.tz/tanzania/business/elon-musk-bids-43-billion-in-hostile-takeover-of-twitter-3782338,The Citizen,2026-05-19
2022-04-14,Unyiha to pay Yara Tanzania Sh476m for breach of contract,https://www.thecitizen.co.tz/tanzania/business/unyiha-to-pay-yara-tanzania-sh476m-for-breach-of-contract-3782188,The Citizen,2026-05-19
2022-04-14,Kenya Airways travellers lose Sh80 billion in expired tickets,https://www.thecitizen.co.tz/tanzania/business/kenya-airways-travellers-lose-sh80-billion-in-expired-tickets-3781932,The Citizen,2026-05-19
2022-04-12,New Uganda car import rule stirs Kenyan market,https://www.thecitizen.co.tz/tanzania/business/uganda-import-rule-boosts-kenya-car-dealers-3779558,The Citizen,2026-05-19
2022-04-11,Kenya Airways defaults on Sh25 billion loan,https://www.thecitizen.co.tz/tanzania/business/kenya-airways-defaults-on-sh25-billion-loan-3778724,The Citizen,2026-05-19
2022-04-11,Jubilee to construct Sh9.2 billion headquarters in Tanzania,https://www.thecitizen.co.tz/tanzania/business/jubilee-to-construct-sh9-2-billion-headquarters-in-tanzania-3778396,The Citizen,2026-05-19
2022-04-06,Millicom completes sale of Zantel and Tigo Tanzania,https://www.thecitizen.co.tz/tanzania/business/millicom-completes-sale-of-zantel-and-tigo-tanzania-3773044,The Citizen,2026-05-19
2022-04-05,Uganda overtakes Tanzania as most profitable regional unit for DTB Group,https://www.thecitizen.co.tz/tanzania/business/uganda-overtakes-tanzania-as-most-profitable-regional-unit-for-dtb-group-3771846,The Citizen,2026-05-19
2022-04-01,Insurance broker targets ‘machingas’ with special product,https://www.thecitizen.co.tz/tanzania/business/insurance-broker-targets-machingas-with-special-product-3768008,The Citizen,2026-05-19
2022-03-31,Huawei-backed underwater cable reaches Kenya,https://www.thecitizen.co.tz/tanzania/business/huawei-backed-underwater-cable-reaches-kenya-3766670,The Citizen,2026-05-19
2022-03-30,"CRDB Bank targets 150,000 after Sh182bn lending deal",https://www.thecitizen.co.tz/tanzania/business/crdb-bank-targets-150-000-after-sh182bn-lending-deal-3765530,The Citizen,2026-05-19
2022-03-17,Mtwara Port and Dangote Cement ink transport deal,https://www.thecitizen.co.tz/tanzania/business/mtwara-port-and-dangote-cement-ink-transport-deal-3751430,The Citizen,2026-05-19
2022-03-17,How fake liquor is hitting government and distilling firms,https://www.thecitizen.co.tz/tanzania/business/how-fake-liquor-is-hitting-government-and-distilling-firms-3751056,The Citizen,2026-05-19
2022-03-16,Tanzania Distilleries Limited to buy 1500 tonnes of grapes,https://www.thecitizen.co.tz/tanzania/business/tanzania-distilleries-limited-to-buy-1500-tonnes-of-grapes-3749804,The Citizen,2026-05-19
2022-03-15,Why money supply in Tanzania has risen in recent months,https://www.thecitizen.co.tz/tanzania/business/why-money-supply-in-tanzania-has-risen-in-recent-months-3748694,The Citizen,2026-05-19
2022-03-10,Tira working to increase number of agents countrywide,https://www.thecitizen.co.tz/tanzania/business/tira-working-to-increase-number-of-agents-countrywide-3743418,The Citizen,2026-05-19
2022-03-09,Sinotruk planning Sh46 billion assembly plant in Tanzania,https://www.thecitizen.co.tz/tanzania/business/sinotruk-planning-sh46-billion-assembly-plant-in-tanzania-3742116,The Citizen,2026-05-19
2022-03-09,Tourism players say No to cable cars on Mt Kilimanjaro,https://www.thecitizen.co.tz/tanzania/business/tourism-players-say-no-to-cable-cars-on-mt-kilimanjaro-3742094,The Citizen,2026-05-19
2022-03-07,"Boeing, Ethiopian Airlines sign deal for new 777-8 freighter",https://www.thecitizen.co.tz/tanzania/business/boeing-ethiopian-airlines-sign-deal-for-new-777-8-freighter-3739880,The Citizen,2026-05-19
2022-03-03,Dar es Salaam and Nairobi City Lodge Hotels up for sale,https://www.thecitizen.co.tz/tanzania/business/dar-es-salaam-and-nairobi-city-lodge-hotels-up-for-sale-3735442,The Citizen,2026-05-19
2022-03-03,Kenya’s dollar millionaires under 40 years revealed,https://www.thecitizen.co.tz/tanzania/business/kenya-s-dollar-millionaires-under-40-years-revealed-3735458,The Citizen,2026-05-19
2022-02-28,Areas Indian investors are interested in Tanzania,https://www.thecitizen.co.tz/tanzania/business/areas-indian-investors-are-interested-in-tanzania-3732486,The Citizen,2026-05-19
2022-02-26,EAC eyes trade-in-services under AfCFTA Agreement,https://www.thecitizen.co.tz/tanzania/business/-eac-eyes-trade-in-services-under-afcfta-agreement-3730410,The Citizen,2026-05-19
2022-02-24,Proposed 35 percent CET aims to boost East Africa trade to $6.8 billion,https://www.thecitizen.co.tz/tanzania/business/proposed-35-percent-cet-aims-to-boost-east-africa-trade-to-6-8-billion-3728332,The Citizen,2026-05-19
2022-02-24,ATCL to enter into partnership with KLM and Emirates,https://www.thecitizen.co.tz/tanzania/business/atcl-to-enter-into-partnership-with-klm-and-emirates--3727724,The Citizen,2026-05-19
2022-02-22,"State oil, gas agencies sign cooperation pact",https://www.thecitizen.co.tz/tanzania/business/state-oil-gas-agencies-sign-cooperation-pact-3725486,The Citizen,2026-05-19
2022-02-19,Kenya-Tanzania trade marches hits Sh2 trillion,https://www.thecitizen.co.tz/tanzania/business/kenya-tanzania-trade-marches-hits-sh2-trillion-3722318,The Citizen,2026-05-19
2022-02-18,SMEs digest: How Meshack found a niche in horticulture,https://www.thecitizen.co.tz/tanzania/business/smes-digest-how-meshack-found-a-niche-in-horticulture-3721360,The Citizen,2026-05-19
2022-02-17,Kenyan arrested after landing at JKIA with $2m cash,https://www.thecitizen.co.tz/tanzania/business/kenyan-arrested-with-usd-2m-cash-at-jkia-from-burundi-3720770,The Citizen,2026-05-19
2022-02-14,Faidika brings its services closer to clients with new digital platform,https://www.thecitizen.co.tz/tanzania/business/faidika-brings-its-services-closer-to-clients-with-new-digital-platform-3716012,The Citizen,2026-05-19
2022-02-14,East African banks under pressure to report climate risks,https://www.thecitizen.co.tz/tanzania/business/banks-under-pressure-to-report-climate-risks-3716486,The Citizen,2026-05-19
2022-02-11,"Tanzania, Kenya trade approaches $1 billion mark",https://www.thecitizen.co.tz/tanzania/business/tanzania-kenya-trade-approaches-1-billion-mark-3712876,The Citizen,2026-05-19
2022-02-11,What's next for TikTok's music industry revolution?,https://www.thecitizen.co.tz/tanzania/business/what-s-next-for-tiktok-s-music-industry-revolution--3712870,The Citizen,2026-05-19
2022-02-11,Low Capital Businesses Offer Practical Solutions For Youth And Women,https://www.thecitizen.co.tz/tanzania/business/tanzania-capital-constraint-hurting-self-employment-initiatives--3727538,The Citizen,2026-05-19
